<?xml version="1.0" encoding="UTF-8"?>

<!ELEMENT document (title+, subjectId, subjectName, prerequisite,classes, assessment,syllabus,textbook, textbooks)>

<!ELEMENT title (#PCDATA) >

<!ELEMENT subjectId (#PCDATA)>

<!ELEMENT subjectName (#PCDATA)>

<!ELEMENT prerequisite (subjectId, subjectName)>

<!ELEMENT classes (#PCDATA)>
<!ELEMENT assessment ANY >
<!ATTLIST assessment assessment_type (exam| assignment) #IMPLIED>
<!ELEMENT syllabus (#PCDATA)>

<!ELEMENT textbook (author,booktitle)>
<!ELEMENT author (#PCDATA)>
<!ELEMENT booktitle (#PCDATA)>

<!ELEMENT textbooks (author,booktitle)>






